{"apiVersion":"kodama/v1alpha2","kind":"Pipeline","metadata":{"name":"agent-gate"},"spec":{"inputs":{},"network":{"edges":[]},"steps":[{"agent":{"profile":"coding-v1"},"id":"implement","kind":"agent","needs":[],"outputs":{},"retry":{"backoffSeconds":0,"maxAttempts":1,"on":[]},"timeoutSeconds":1800,"workspace":{"access":"write"}},{"gate":{"evidence":[]},"id":"review","kind":"gate","needs":["implement"]},{"args":[],"command":["/bin/true"],"egress":[],"env":{},"id":"ship","image":"registry.example.invalid/tools@sha256:1111111111111111111111111111111111111111111111111111111111111111","kind":"container","needs":["review"],"outputs":{},"retry":{"backoffSeconds":0,"maxAttempts":1,"on":[]},"secretFiles":{},"timeoutSeconds":60}],"timeoutSeconds":7200}}