{"apiVersion":"kodama/v1alpha2","kind":"Pipeline","metadata":{"name":"integration-build"},"spec":{"inputs":{},"network":{"edges":[]},"runWorkspace":{"sizeMiB":4096},"services":{"browser":{"args":[],"egress":["preview"],"env":{},"image":"registry.example.invalid/headless-browser@sha256:2222222222222222222222222222222222222222222222222222222222222222","ports":{"devtools":{"port":3000,"protocol":"TCP"}},"readiness":{"http":{"path":"/json/version","port":"devtools"},"lossSeconds":30,"periodSeconds":2,"probeTimeoutSeconds":5,"timeoutSeconds":60},"resources":{"cpuMillis":1000,"ephemeralMiB":512,"memoryMiB":1024,"shmMiB":512},"role":"general","secretFiles":{},"storage":[]},"db":{"args":[],"command":["/usr/local/bin/docker-entrypoint.sh","postgres"],"egress":[],"env":{"POSTGRES_DB":"app","POSTGRES_PASSWORD_FILE":"/kodama/secrets/postgres-password","POSTGRES_USER":"kodama"},"image":"registry.example.invalid/postgres-rootless@sha256:1111111111111111111111111111111111111111111111111111111111111111","ports":{"sql":{"port":5432,"protocol":"TCP"}},"readiness":{"exec":["pg_isready","-U","kodama","-d","app"],"lossSeconds":30,"periodSeconds":2,"probeTimeoutSeconds":5,"timeoutSeconds":60},"resources":{"cpuMillis":500,"ephemeralMiB":256,"memoryMiB":512,"shmMiB":64},"role":"general","secretFiles":{"postgres-password":"secret://project/test-db-password"},"storage":[{"path":"/var/lib/postgresql/data","sizeMiB":1024}]}},"steps":[{"args":["cd /workspace && go generate ./..."],"command":["/bin/sh","-ec"],"egress":[],"env":{},"id":"generate","image":"registry.example.invalid/go-tools@sha256:3333333333333333333333333333333333333333333333333333333333333333","kind":"container","needs":[],"outputs":{},"retry":{"backoffSeconds":0,"maxAttempts":1,"on":[]},"secretFiles":{},"timeoutSeconds":600,"workspace":{"access":"write"}},{"args":["cd /workspace && go test ./..."],"command":["/bin/sh","-ec"],"egress":[],"env":{"BROWSER_HOST":"${{ services.browser.host }}","BROWSER_PORT":"${{ services.browser.ports.devtools }}","PGDATABASE":"app","PGHOST":"${{ services.db.host }}","PGPASSWORD":{"secretRef":"secret://project/test-db-password"},"PGPORT":"${{ services.db.ports.sql }}","PGUSER":"kodama"},"id":"integration","image":"registry.example.invalid/test-tools@sha256:4444444444444444444444444444444444444444444444444444444444444444","kind":"container","needs":["generate"],"outputs":{"report":{"path":"/kodama/outputs/tests.json","type":"artifact"}},"retry":{"backoffSeconds":0,"maxAttempts":1,"on":[]},"secretFiles":{},"timeoutSeconds":1200}],"timeoutSeconds":3600}}