{"apiVersion":"kodama/v1alpha2","kind":"Pipeline","metadata":{"name":"order-gates"},"spec":{"inputs":{},"network":{"edges":[]},"steps":[{"args":[],"command":["/bin/true"],"egress":[],"env":{},"id":"test","image":"registry.example.invalid/tools@sha256:1111111111111111111111111111111111111111111111111111111111111111","kind":"container","needs":[],"outputs":{},"retry":{"backoffSeconds":0,"maxAttempts":1,"on":[]},"secretFiles":{},"timeoutSeconds":60,"workspace":{"access":"write"}},{"gate":{"evidence":[]},"id":"review","kind":"gate","needs":["test"]},{"args":[],"command":["/bin/true"],"egress":[],"env":{},"id":"build","image":"registry.example.invalid/tools@sha256:1111111111111111111111111111111111111111111111111111111111111111","kind":"container","needs":["review"],"outputs":{},"retry":{"backoffSeconds":0,"maxAttempts":1,"on":[]},"secretFiles":{},"timeoutSeconds":60},{"args":[],"command":["/bin/true"],"egress":[],"env":{},"id":"lint","image":"registry.example.invalid/tools@sha256:1111111111111111111111111111111111111111111111111111111111111111","kind":"container","needs":[],"outputs":{},"retry":{"backoffSeconds":0,"maxAttempts":1,"on":[]},"secretFiles":{},"timeoutSeconds":60}],"timeoutSeconds":7200}}