{"apiVersion":"kodama/v1alpha2","kind":"Pipeline","metadata":{"name":"edges-and-endpoints"},"spec":{"inputs":{"region":{"default":"eu","required":false,"type":"string"}},"network":{"edges":[{"from":"app","ports":["sql"],"to":"db"},{"from":"db","ports":["http","admin"],"to":"app"}]},"runWorkspace":{"sizeMiB":512},"services":{"app":{"args":[],"command":["/usr/bin/app"],"egress":["registry"],"env":{"DB_HOST":"${{ services.db.host }}","DB_PORT":"${{ services.db.ports.sql }}","PLAIN":"literal","REGION":"${{ inputs.region }}"},"image":"registry.example.invalid/app@sha256:1111111111111111111111111111111111111111111111111111111111111111","ports":{"admin":{"port":9090,"protocol":"TCP"},"http":{"port":8080,"protocol":"TCP"}},"readiness":{"http":{"path":"/healthz","port":"http"},"lossSeconds":20,"periodSeconds":5,"probeTimeoutSeconds":3,"timeoutSeconds":60},"resources":{"cpuMillis":250,"ephemeralMiB":128,"memoryMiB":256,"shmMiB":0},"role":"general","secretFiles":{},"storage":[]},"buildkit":{"args":[],"command":["/usr/bin/buildkitd"],"egress":[],"env":{},"image":"registry.example.invalid/buildkit@sha256:3333333333333333333333333333333333333333333333333333333333333333","ports":{"grpc":{"port":1234,"protocol":"TCP"}},"readiness":{"lossSeconds":30,"periodSeconds":2,"probeTimeoutSeconds":5,"tcp":"grpc","timeoutSeconds":120},"resources":{"cpuMillis":2000,"ephemeralMiB":1024,"memoryMiB":2048,"shmMiB":64},"role":"builder","secretFiles":{},"storage":[]},"db":{"args":[],"egress":[],"env":{},"image":"registry.example.invalid/db@sha256:2222222222222222222222222222222222222222222222222222222222222222","ports":{"sql":{"port":5432,"protocol":"TCP"}},"readiness":{"exec":["pg_isready","-U","kodama"],"lossSeconds":30,"periodSeconds":2,"probeTimeoutSeconds":5,"timeoutSeconds":60},"resources":{"cpuMillis":500,"ephemeralMiB":256,"memoryMiB":512,"shmMiB":64},"role":"general","secretFiles":{},"storage":[{"path":"/var/lib/db","sizeMiB":128},{"path":"/var/cache/db","sizeMiB":64}]}},"steps":[{"args":["curl -fsS \"http://$APP_HOST:$APP_PORT/\" >/dev/null"],"command":["/bin/sh","-ec"],"egress":["registry","preview"],"env":{"APP_HOST":"${{ services.app.host }}","APP_PORT":"${{ services.app.ports.http }}","REGION":"${{ inputs.region }}"},"id":"smoke","image":"registry.example.invalid/tools@sha256:1111111111111111111111111111111111111111111111111111111111111111","kind":"container","needs":[],"outputs":{},"retry":{"backoffSeconds":0,"maxAttempts":1,"on":[]},"secretFiles":{},"timeoutSeconds":300,"workspace":{"access":"read"}}],"timeoutSeconds":3600}}