{"apiVersion":"kodama/v1alpha2","kind":"Pipeline","metadata":{"name":"source-free-cleanup"},"spec":{"inputs":{"deployment_id":{"required":true,"type":"string"}},"network":{"edges":[]},"steps":[{"args":["${{ inputs.deployment_id }}"],"command":["/opt/kodama/delete.sh"],"egress":[],"env":{},"id":"teardown","image":"registry.example.invalid/ops@sha256:1111111111111111111111111111111111111111111111111111111111111111","kind":"container","needs":[],"outputs":{},"retry":{"backoffSeconds":0,"maxAttempts":1,"on":[]},"secretFiles":{},"timeoutSeconds":600,"workspace":{"access":"none"}},{"args":["test -s /workspace/teardown.log"],"command":["/bin/sh","-ec"],"egress":[],"env":{},"id":"verify","image":"registry.example.invalid/ops@sha256:2222222222222222222222222222222222222222222222222222222222222222","kind":"container","needs":["teardown"],"outputs":{},"retry":{"backoffSeconds":0,"maxAttempts":1,"on":[]},"secretFiles":{},"timeoutSeconds":60}],"timeoutSeconds":900}}