{"apiVersion":"kodama/v1alpha2","kind":"Pipeline","metadata":{"name":"service-test"},"spec":{"inputs":{},"network":{"edges":[]},"services":{"db":{"args":[],"egress":[],"env":{"POSTGRES_DB":"app","POSTGRES_USER":"kodama"},"image":"registry.example.invalid/postgres-rootless@sha256:1111111111111111111111111111111111111111111111111111111111111111","ports":{"sql":{"port":5432,"protocol":"TCP"}},"readiness":{"lossSeconds":30,"periodSeconds":2,"probeTimeoutSeconds":5,"tcp":"sql","timeoutSeconds":60},"resources":{"cpuMillis":500,"ephemeralMiB":256,"memoryMiB":512,"shmMiB":64},"role":"general","secretFiles":{},"storage":[{"path":"/var/lib/postgresql/data","sizeMiB":1024}]}},"steps":[{"args":["cd /workspace && go test ./..."],"command":["/bin/sh","-ec"],"egress":[],"env":{"PGHOST":"${{ services.db.host }}","PGPORT":"${{ services.db.ports.sql }}"},"id":"test","image":"registry.example.invalid/go-tools@sha256:2222222222222222222222222222222222222222222222222222222222222222","kind":"container","needs":[],"outputs":{},"retry":{"backoffSeconds":0,"maxAttempts":1,"on":[]},"secretFiles":{},"timeoutSeconds":600}],"timeoutSeconds":1800}}