{"apiVersion":"kodama/v1alpha2","kind":"Pipeline","metadata":{"name":"argv-matrix"},"spec":{"inputs":{},"network":{"edges":[]},"services":{"argsonly":{"args":["--serve","--quiet"],"egress":[],"env":{},"image":"registry.example.invalid/svc-argsonly@sha256:1111111111111111111111111111111111111111111111111111111111111111","ports":{"p":{"port":8080,"protocol":"TCP"}},"readiness":{"lossSeconds":30,"periodSeconds":2,"probeTimeoutSeconds":5,"tcp":"p","timeoutSeconds":30},"resources":{"cpuMillis":100,"ephemeralMiB":64,"memoryMiB":64,"shmMiB":64},"role":"general","secretFiles":{},"storage":[]},"both":{"args":["--quiet"],"command":["/usr/bin/serve"],"egress":[],"env":{},"image":"registry.example.invalid/svc-both@sha256:1111111111111111111111111111111111111111111111111111111111111111","ports":{"p":{"port":8080,"protocol":"TCP"}},"readiness":{"lossSeconds":30,"periodSeconds":2,"probeTimeoutSeconds":5,"tcp":"p","timeoutSeconds":30},"resources":{"cpuMillis":100,"ephemeralMiB":64,"memoryMiB":64,"shmMiB":64},"role":"general","secretFiles":{},"storage":[]},"commandonly":{"args":[],"command":["/usr/bin/serve"],"egress":[],"env":{},"image":"registry.example.invalid/svc-commandonly@sha256:1111111111111111111111111111111111111111111111111111111111111111","ports":{"p":{"port":8080,"protocol":"TCP"}},"readiness":{"lossSeconds":30,"periodSeconds":2,"probeTimeoutSeconds":5,"tcp":"p","timeoutSeconds":30},"resources":{"cpuMillis":100,"ephemeralMiB":64,"memoryMiB":64,"shmMiB":64},"role":"general","secretFiles":{},"storage":[]},"defaults":{"args":[],"egress":[],"env":{},"image":"registry.example.invalid/svc-defaults@sha256:1111111111111111111111111111111111111111111111111111111111111111","ports":{"p":{"port":8080,"protocol":"TCP"}},"readiness":{"lossSeconds":30,"periodSeconds":2,"probeTimeoutSeconds":5,"tcp":"p","timeoutSeconds":30},"resources":{"cpuMillis":100,"ephemeralMiB":64,"memoryMiB":64,"shmMiB":64},"role":"general","secretFiles":{},"storage":[]}},"steps":[{"args":[],"command":["/bin/true"],"egress":[],"env":{},"id":"test","image":"registry.example.invalid/tools@sha256:2222222222222222222222222222222222222222222222222222222222222222","kind":"container","needs":[],"outputs":{},"retry":{"backoffSeconds":0,"maxAttempts":1,"on":[]},"secretFiles":{},"timeoutSeconds":60}],"timeoutSeconds":600}}